author,publish_time,rates,title
,,,"装甲少女艾丽卡Vol.04（本应享受青春的少女们被送上战场对抗虫兽，日常的欢乐夹杂在血腥的战争之中，这是一部专属于少女们的物语……） (轻小说系列),舍管、匿于魔女学院之巅Vol.03（试验型当代女子魔法高中生圈养实践论） (轻小说系列),装甲少女艾丽卡Vol.01（本应享受青春的少女们被送上战场对抗虫兽，日常的欢乐夹杂在血腥的战争之中，这是一部专属于少女们的物语……） (轻小说系列),装甲少女艾丽卡Vol.02（本应享受青春的少女们被送上战场对抗虫兽，日常的欢乐夹杂在血腥的战争之中，这是一部专属于少女们的物语……） (轻小说系列),舍管、匿于魔女学院之巅Vol.02（试验型当代女子魔法高中生圈养实践论） (轻小说系列),装甲少女艾丽卡Vol.03（本应享受青春的少女们被送上战场对抗虫兽，日常的欢乐夹杂在血腥的战争之中，这是一部专属于少女们的物语……） (轻小说系列),法学理论前沿（谷臻小简·AI导读版）（本书是上海社会科学院哲学社会科学创新工程学术前沿丛书中的一本，聚焦和探索十八大以来我国社会主义法治建设的重要进展，深入研究依法治国的重大理论问题和实践问题。）,装甲少女艾丽卡Vol.04（本应享受青春的少女们被送上战场对抗虫兽，日常的欢乐夹杂在血腥的战争之中，这是一部专属于少女们的物语……） (轻小说系列),装甲少女艾丽卡Vol.04（本应享受青春的少女们被送上战场对抗虫兽，日常的欢乐夹杂在血腥的战争之中，这是一部专属于少女们的物语……） (轻小说系列),装甲少女艾丽卡Vol.04（本应享受青春的少女们被送上战场对抗虫兽，日常的欢乐夹杂在血腥的战争之中，这是一部专属于少女们的物语……） (轻小说系列),舍管、匿于魔女学院之巅Vol.03（试验型当代女子魔法高中生圈养实践论） (轻小说系列),舍管、匿于魔女学院之巅Vol.03（试验型当代女子魔法高中生圈养实践论） (轻小说系列),舍管、匿于魔女学院之巅Vol.03（试验型当代女子魔法高中生圈养实践论） (轻小说系列),装甲少女艾丽卡Vol.01（本应享受青春的少女们被送上战场对抗虫兽，日常的欢乐夹杂在血腥的战争之中，这是一部专属于少女们的物语……） (轻小说系列),装甲少女艾丽卡Vol.01（本应享受青春的少女们被送上战场对抗虫兽，日常的欢乐夹杂在血腥的战争之中，这是一部专属于少女们的物语……） (轻小说系列),装甲少女艾丽卡Vol.01（本应享受青春的少女们被送上战场对抗虫兽，日常的欢乐夹杂在血腥的战争之中，这是一部专属于少女们的物语……） (轻小说系列),装甲少女艾丽卡Vol.02（本应享受青春的少女们被送上战场对抗虫兽，日常的欢乐夹杂在血腥的战争之中，这是一部专属于少女们的物语……） (轻小说系列),装甲少女艾丽卡Vol.02（本应享受青春的少女们被送上战场对抗虫兽，日常的欢乐夹杂在血腥的战争之中，这是一部专属于少女们的物语……） (轻小说系列),装甲少女艾丽卡Vol.02（本应享受青春的少女们被送上战场对抗虫兽，日常的欢乐夹杂在血腥的战争之中，这是一部专属于少女们的物语……） (轻小说系列),舍管、匿于魔女学院之巅Vol.02（试验型当代女子魔法高中生圈养实践论） (轻小说系列),舍管、匿于魔女学院之巅Vol.02（试验型当代女子魔法高中生圈养实践论） (轻小说系列),舍管、匿于魔女学院之巅Vol.02（试验型当代女子魔法高中生圈养实践论） (轻小说系列),装甲少女艾丽卡Vol.03（本应享受青春的少女们被送上战场对抗虫兽，日常的欢乐夹杂在血腥的战争之中，这是一部专属于少女们的物语……） (轻小说系列),装甲少女艾丽卡Vol.03（本应享受青春的少女们被送上战场对抗虫兽，日常的欢乐夹杂在血腥的战争之中，这是一部专属于少女们的物语……） (轻小说系列),装甲少女艾丽卡Vol.03（本应享受青春的少女们被送上战场对抗虫兽，日常的欢乐夹杂在血腥的战争之中，这是一部专属于少女们的物语……） (轻小说系列),法学理论前沿（谷臻小简·AI导读版）（本书是上海社会科学院哲学社会科学创新工程学术前沿丛书中的一本，聚焦和探索十八大以来我国社会主义法治建设的重要进展，深入研究依法治国的重大理论问题和实践问题。）,法学理论前沿（谷臻小简·AI导读版）（本书是上海社会科学院哲学社会科学创新工程学术前沿丛书中的一本，聚焦和探索十八大以来我国社会主义法治建设的重要进展，深入研究依法治国的重大理论问题和实践问题。）,法学理论前沿（谷臻小简·AI导读版）（本书是上海社会科学院哲学社会科学创新工程学术前沿丛书中的一本，聚焦和探索十八大以来我国社会主义法治建设的重要进展，深入研究依法治国的重大理论问题和实践问题。）"
,,,"台湾启示录（上） (香港凤凰周刊文丛系列),知乎周刊·商业的细节,知乎周刊・没钱也要理财（总第 155 期）,埃博拉，在门外徘徊的幽灵（纽约时报特辑）（荣获2015年度普利策新闻奖国际新闻报道奖）,香港：是沙漠还是绿洲 (腾讯大家),台湾启示录（下） (香港凤凰周刊文丛系列),我成为怪物那天（郭敬明携七位全球华语科幻星云奖、银河奖获奖作家倾力打造《最小说》选题书第二辑。每一个卑微的异类，都是世界的眼泪。）,鲁迅密码 香港凤凰周刊2016年第31期,世界遗产地理·新疆边城——要塞、美景与史诗,《蜜爱·爱出色》特刊(十),《科幻世界》2013年合集,朝鲜麻烦：解密朝鲜核武之路 (香港凤凰周刊精选故事),设计思维演进（《哈佛商业评论》2015年第9期）,《科幻世界》2014年合集,汽车导报 月刊 2017年05期,少年时·飞机大解剖：飞行的秘密,台湾启示录（上） (香港凤凰周刊文丛系列),台湾启示录（上） (香港凤凰周刊文丛系列),台湾启示录（上） (香港凤凰周刊文丛系列),知乎周刊·商业的细节,知乎周刊·商业的细节,知乎周刊·商业的细节,知乎周刊・没钱也要理财（总第 155 期）,知乎周刊・没钱也要理财（总第 155 期）,知乎周刊・没钱也要理财（总第 155 期）,埃博拉，在门外徘徊的幽灵（纽约时报特辑）（荣获2015年度普利策新闻奖国际新闻报道奖）,埃博拉，在门外徘徊的幽灵（纽约时报特辑）（荣获2015年度普利策新闻奖国际新闻报道奖）,埃博拉，在门外徘徊的幽灵（纽约时报特辑）（荣获2015年度普利策新闻奖国际新闻报道奖）,香港：是沙漠还是绿洲 (腾讯大家),香港：是沙漠还是绿洲 (腾讯大家),香港：是沙漠还是绿洲 (腾讯大家),台湾启示录（下） (香港凤凰周刊文丛系列),台湾启示录（下） (香港凤凰周刊文丛系列),台湾启示录（下） (香港凤凰周刊文丛系列),我成为怪物那天（郭敬明携七位全球华语科幻星云奖、银河奖获奖作家倾力打造《最小说》选题书第二辑。每一个卑微的异类，都是世界的眼泪。）,我成为怪物那天（郭敬明携七位全球华语科幻星云奖、银河奖获奖作家倾力打造《最小说》选题书第二辑。每一个卑微的异类，都是世界的眼泪。）,我成为怪物那天（郭敬明携七位全球华语科幻星云奖、银河奖获奖作家倾力打造《最小说》选题书第二辑。每一个卑微的异类，都是世界的眼泪。）,鲁迅密码 香港凤凰周刊2016年第31期,鲁迅密码 香港凤凰周刊2016年第31期,鲁迅密码 香港凤凰周刊2016年第31期,世界遗产地理·新疆边城——要塞、美景与史诗,世界遗产地理·新疆边城——要塞、美景与史诗,世界遗产地理·新疆边城——要塞、美景与史诗,《蜜爱·爱出色》特刊(十),《蜜爱·爱出色》特刊(十),《蜜爱·爱出色》特刊(十),《科幻世界》2013年合集,《科幻世界》2013年合集,《科幻世界》2013年合集,朝鲜麻烦：解密朝鲜核武之路 (香港凤凰周刊精选故事),朝鲜麻烦：解密朝鲜核武之路 (香港凤凰周刊精选故事),朝鲜麻烦：解密朝鲜核武之路 (香港凤凰周刊精选故事),设计思维演进（《哈佛商业评论》2015年第9期）,设计思维演进（《哈佛商业评论》2015年第9期）,设计思维演进（《哈佛商业评论》2015年第9期）,《科幻世界》2014年合集,《科幻世界》2014年合集,《科幻世界》2014年合集,汽车导报 月刊 2017年05期,汽车导报 月刊 2017年05期,汽车导报 月刊 2017年05期,少年时·飞机大解剖：飞行的秘密,少年时·飞机大解剖：飞行的秘密,少年时·飞机大解剖：飞行的秘密"
,,,"我的第一套百科全书:宇宙探秘,图解天工开物(白话全译彩图本) (世界上影响最大的中国古代百科全书),NBA年鉴 (NBA厚度系列丛书),汉字趣味图典 (中华书局出品),一生要读的国学经典(读书百遍  其义自现 国学经典  浩瀚无边) (N 一生要读的国学经典),西方哲学常识：迅速了解西方哲学思想的百科全书,一生的读书计划（这一版有实质性的修订和扩充，最突出的变化是推荐的阅读材料的来源范围已经扩展到整个世界的经典名著。） (阅读指南),色彩的性格（2016）（内含大量精美名家名画插图，一本关于色彩世界的百科全书）,Excel公式与函数大辞典(附光盘)(光盘1张),魔鬼辞典（颠覆一切固有概念的万物辞典。风靡全球100年的惊世骇俗之作，蒙尘20年回归大众视野。）,英汉·汉英餐饮分类词汇,我的第一套百科全书:动物世界,黄克诚年谱,家庭医学健康百科全书(彩图精装） (中国家庭必备工具书),原谅就是力量（“为何原谅”及“如何原谅”的自我疗愈指南，一本探讨“原谅”心理行为的实用工具书）,法律名词一本通,我的第一套百科全书:宇宙探秘,我的第一套百科全书:宇宙探秘,我的第一套百科全书:宇宙探秘,图解天工开物(白话全译彩图本) (世界上影响最大的中国古代百科全书),图解天工开物(白话全译彩图本) (世界上影响最大的中国古代百科全书),图解天工开物(白话全译彩图本) (世界上影响最大的中国古代百科全书),NBA年鉴 (NBA厚度系列丛书),NBA年鉴 (NBA厚度系列丛书),NBA年鉴 (NBA厚度系列丛书),汉字趣味图典 (中华书局出品),汉字趣味图典 (中华书局出品),汉字趣味图典 (中华书局出品),一生要读的国学经典(读书百遍  其义自现 国学经典  浩瀚无边) (N 一生要读的国学经典),一生要读的国学经典(读书百遍  其义自现 国学经典  浩瀚无边) (N 一生要读的国学经典),一生要读的国学经典(读书百遍  其义自现 国学经典  浩瀚无边) (N 一生要读的国学经典),西方哲学常识：迅速了解西方哲学思想的百科全书,西方哲学常识：迅速了解西方哲学思想的百科全书,西方哲学常识：迅速了解西方哲学思想的百科全书,一生的读书计划（这一版有实质性的修订和扩充，最突出的变化是推荐的阅读材料的来源范围已经扩展到整个世界的经典名著。） (阅读指南),一生的读书计划（这一版有实质性的修订和扩充，最突出的变化是推荐的阅读材料的来源范围已经扩展到整个世界的经典名著。） (阅读指南),一生的读书计划（这一版有实质性的修订和扩充，最突出的变化是推荐的阅读材料的来源范围已经扩展到整个世界的经典名著。） (阅读指南),色彩的性格（2016）（内含大量精美名家名画插图，一本关于色彩世界的百科全书）,色彩的性格（2016）（内含大量精美名家名画插图，一本关于色彩世界的百科全书）,色彩的性格（2016）（内含大量精美名家名画插图，一本关于色彩世界的百科全书）,Excel公式与函数大辞典(附光盘)(光盘1张),Excel公式与函数大辞典(附光盘)(光盘1张),Excel公式与函数大辞典(附光盘)(光盘1张),魔鬼辞典（颠覆一切固有概念的万物辞典。风靡全球100年的惊世骇俗之作，蒙尘20年回归大众视野。）,魔鬼辞典（颠覆一切固有概念的万物辞典。风靡全球100年的惊世骇俗之作，蒙尘20年回归大众视野。）,魔鬼辞典（颠覆一切固有概念的万物辞典。风靡全球100年的惊世骇俗之作，蒙尘20年回归大众视野。）,英汉·汉英餐饮分类词汇,英汉·汉英餐饮分类词汇,英汉·汉英餐饮分类词汇,我的第一套百科全书:动物世界,我的第一套百科全书:动物世界,我的第一套百科全书:动物世界,黄克诚年谱,黄克诚年谱,黄克诚年谱,家庭医学健康百科全书(彩图精装） (中国家庭必备工具书),家庭医学健康百科全书(彩图精装） (中国家庭必备工具书),家庭医学健康百科全书(彩图精装） (中国家庭必备工具书),原谅就是力量（“为何原谅”及“如何原谅”的自我疗愈指南，一本探讨“原谅”心理行为的实用工具书）,原谅就是力量（“为何原谅”及“如何原谅”的自我疗愈指南，一本探讨“原谅”心理行为的实用工具书）,原谅就是力量（“为何原谅”及“如何原谅”的自我疗愈指南，一本探讨“原谅”心理行为的实用工具书）,法律名词一本通,法律名词一本通,法律名词一本通"
,,,"吴清源回忆录：以文会友（一生只为一件事的纯粹人，围棋世界中神一样的存在，动荡岁月里的传奇人生）,韦特塔罗(精装版),足球豪门第1卷,排球技术与战术教练指导手册,永不后退:迈克.泰森自传,围棋入门升级版,美军生存手册,超体能健身（潘石屹、骆家辉、张欣、严彬博士、姜文、洪晃一致推荐！每天8分钟，8周造就超级体能！一线地产大亨、演艺明星、投行大佬、创业新贵争相学习的高端私教课程首次公开）,遇险自救 自我防卫 野外生存,力量训练减脂圣经,跑步时该如何呼吸 (心视界),数字游戏：关于足球，你全弄错了……吗？（大数据时代的足球圣经，给足球迷、足球从业者的权威指南！吴晓波、黄博文等力荐！）,看图学游泳,12周练出极致身形 美国健美冠军的终极健身计划,塔罗全书(珍藏版),棋经十三篇：宋代以来最权威的围棋理论著作（国之学原版点注）,吴清源回忆录：以文会友（一生只为一件事的纯粹人，围棋世界中神一样的存在，动荡岁月里的传奇人生）,吴清源回忆录：以文会友（一生只为一件事的纯粹人，围棋世界中神一样的存在，动荡岁月里的传奇人生）,吴清源回忆录：以文会友（一生只为一件事的纯粹人，围棋世界中神一样的存在，动荡岁月里的传奇人生）,韦特塔罗(精装版),韦特塔罗(精装版),韦特塔罗(精装版),足球豪门第1卷,足球豪门第1卷,足球豪门第1卷,排球技术与战术教练指导手册,排球技术与战术教练指导手册,排球技术与战术教练指导手册,永不后退:迈克.泰森自传,永不后退:迈克.泰森自传,永不后退:迈克.泰森自传,围棋入门升级版,围棋入门升级版,围棋入门升级版,美军生存手册,美军生存手册,美军生存手册,超体能健身（潘石屹、骆家辉、张欣、严彬博士、姜文、洪晃一致推荐！每天8分钟，8周造就超级体能！一线地产大亨、演艺明星、投行大佬、创业新贵争相学习的高端私教课程首次公开）,超体能健身（潘石屹、骆家辉、张欣、严彬博士、姜文、洪晃一致推荐！每天8分钟，8周造就超级体能！一线地产大亨、演艺明星、投行大佬、创业新贵争相学习的高端私教课程首次公开）,超体能健身（潘石屹、骆家辉、张欣、严彬博士、姜文、洪晃一致推荐！每天8分钟，8周造就超级体能！一线地产大亨、演艺明星、投行大佬、创业新贵争相学习的高端私教课程首次公开）,遇险自救 自我防卫 野外生存,遇险自救 自我防卫 野外生存,遇险自救 自我防卫 野外生存,力量训练减脂圣经,力量训练减脂圣经,力量训练减脂圣经,跑步时该如何呼吸 (心视界),跑步时该如何呼吸 (心视界),跑步时该如何呼吸 (心视界),数字游戏：关于足球，你全弄错了……吗？（大数据时代的足球圣经，给足球迷、足球从业者的权威指南！吴晓波、黄博文等力荐！）,数字游戏：关于足球，你全弄错了……吗？（大数据时代的足球圣经，给足球迷、足球从业者的权威指南！吴晓波、黄博文等力荐！）,数字游戏：关于足球，你全弄错了……吗？（大数据时代的足球圣经，给足球迷、足球从业者的权威指南！吴晓波、黄博文等力荐！）,看图学游泳,看图学游泳,看图学游泳,12周练出极致身形 美国健美冠军的终极健身计划,12周练出极致身形 美国健美冠军的终极健身计划,12周练出极致身形 美国健美冠军的终极健身计划,塔罗全书(珍藏版),塔罗全书(珍藏版),塔罗全书(珍藏版),棋经十三篇：宋代以来最权威的围棋理论著作（国之学原版点注）,棋经十三篇：宋代以来最权威的围棋理论著作（国之学原版点注）,棋经十三篇：宋代以来最权威的围棋理论著作（国之学原版点注）"
,,,"在建筑中发现梦想（安藤忠雄首部对世界建筑的深刻思考和理念精华之作）,不烦不累扫一屋,千里之行 启程用户体验设计之路,建筑设计手绘效果图快速表现 (艺术设计与实践),室内设计手绘效果图快速表现 (艺术设计与实践),数码摄影构图·光影·色彩,时尚达人的服饰潮搭与网购指南,巴比伦富翁的理财课:有史以来最完美的致富圣经,随园食单(活得要任性，吃得要讲究。乾隆才子袁枚平生九大爱好，第一是“吃饭”，读书排最后。“豆腐煮得好，远胜燕窝；海菜若烧得不好，不如竹笋。”饮食，是大雅学问。)(果麦经典),简易机器人制作入门 (创客教育),3ds Max建筑动画与特效火星课堂——花草树木环境篇 (火星时代系列丛书 13),财富传承工具与实务：保险·家族信托·保险金信托,音乐基础知识：音乐理论入门（谷臻小简·AI导读版）（雷纳在这本重新汇编整理的音乐理论入门读物中为我们介绍了数十年来这方面的基本知识。）,化妆造型技术完全自学手册,麦克手绘 室内快题设计与表现,After Effects 移动UI动效设计 案例精粹（异步图书）,在建筑中发现梦想（安藤忠雄首部对世界建筑的深刻思考和理念精华之作）,在建筑中发现梦想（安藤忠雄首部对世界建筑的深刻思考和理念精华之作）,在建筑中发现梦想（安藤忠雄首部对世界建筑的深刻思考和理念精华之作）,不烦不累扫一屋,不烦不累扫一屋,不烦不累扫一屋,千里之行 启程用户体验设计之路,千里之行 启程用户体验设计之路,千里之行 启程用户体验设计之路,建筑设计手绘效果图快速表现 (艺术设计与实践),建筑设计手绘效果图快速表现 (艺术设计与实践),建筑设计手绘效果图快速表现 (艺术设计与实践),室内设计手绘效果图快速表现 (艺术设计与实践),室内设计手绘效果图快速表现 (艺术设计与实践),室内设计手绘效果图快速表现 (艺术设计与实践),数码摄影构图·光影·色彩,数码摄影构图·光影·色彩,数码摄影构图·光影·色彩,时尚达人的服饰潮搭与网购指南,时尚达人的服饰潮搭与网购指南,时尚达人的服饰潮搭与网购指南,巴比伦富翁的理财课:有史以来最完美的致富圣经,巴比伦富翁的理财课:有史以来最完美的致富圣经,巴比伦富翁的理财课:有史以来最完美的致富圣经,随园食单(活得要任性，吃得要讲究。乾隆才子袁枚平生九大爱好，第一是“吃饭”，读书排最后。“豆腐煮得好，远胜燕窝；海菜若烧得不好，不如竹笋。”饮食，是大雅学问。)(果麦经典),随园食单(活得要任性，吃得要讲究。乾隆才子袁枚平生九大爱好，第一是“吃饭”，读书排最后。“豆腐煮得好，远胜燕窝；海菜若烧得不好，不如竹笋。”饮食，是大雅学问。)(果麦经典),随园食单(活得要任性，吃得要讲究。乾隆才子袁枚平生九大爱好，第一是“吃饭”，读书排最后。“豆腐煮得好，远胜燕窝；海菜若烧得不好，不如竹笋。”饮食，是大雅学问。)(果麦经典),简易机器人制作入门 (创客教育),简易机器人制作入门 (创客教育),简易机器人制作入门 (创客教育),3ds Max建筑动画与特效火星课堂——花草树木环境篇 (火星时代系列丛书 13),3ds Max建筑动画与特效火星课堂——花草树木环境篇 (火星时代系列丛书 13),3ds Max建筑动画与特效火星课堂——花草树木环境篇 (火星时代系列丛书 13),财富传承工具与实务：保险·家族信托·保险金信托,财富传承工具与实务：保险·家族信托·保险金信托,财富传承工具与实务：保险·家族信托·保险金信托,音乐基础知识：音乐理论入门（谷臻小简·AI导读版）（雷纳在这本重新汇编整理的音乐理论入门读物中为我们介绍了数十年来这方面的基本知识。）,音乐基础知识：音乐理论入门（谷臻小简·AI导读版）（雷纳在这本重新汇编整理的音乐理论入门读物中为我们介绍了数十年来这方面的基本知识。）,音乐基础知识：音乐理论入门（谷臻小简·AI导读版）（雷纳在这本重新汇编整理的音乐理论入门读物中为我们介绍了数十年来这方面的基本知识。）,化妆造型技术完全自学手册,化妆造型技术完全自学手册,化妆造型技术完全自学手册,麦克手绘 室内快题设计与表现,麦克手绘 室内快题设计与表现,麦克手绘 室内快题设计与表现,After Effects 移动UI动效设计 案例精粹（异步图书）,After Effects 移动UI动效设计 案例精粹（异步图书）,After Effects 移动UI动效设计 案例精粹（异步图书）"
