author,publish_time,rates,title
,,,"领闲半步（谷臻小简·AI导读版）（为我国饭店业的同行相互借鉴、互相协助提供了一份学习材料，更是作者对我国饭店业作出的一大贡献。）,传统中国研究集刊.第12、13合辑（谷臻小简·AI导读版）（《传统中国研究集刊》由上海社会科学院历史研究所编纂，是一本有较高学术质量的不定期学术集刊。）,感受德意志（谷臻小简·AI导读版）（德国造就了世界上最杰出的哲学家、诗人、戏剧家和音乐家，让我们感受到德国诗意的浪漫和扑面而来的活力。）,拖行棺木的芬里尔Vol.02（一个被称为‘纳粹’的不死身魔男从阿根廷苏醒，背负着装有神秘少女的钢铁棺材一路步往美国西海岸，究竟会发生什么呢！） (轻小说系列),装甲少女艾丽卡（套装4册）（本应享受青春的少女们被送上战场对抗虫兽，日常的欢乐夹杂在血腥的战争之中，这是一部专属于少女们的物语……） (轻小说系列),我家聊斋不正经（一条千年白鲟鱼精，在大都市开始快乐地生活，溜溜弯，逛逛街，吵吵架，谈谈情……）,民族志：政治学科学化“手术刀”（谷臻小简·AI导读版）（这是一本专门研究田野研究的撰写文本“民族志”的论文汇集。
）,我不能再谈那些遗忘（谷臻小简·AI导读版）（35岁以后，我发现只有学会遗忘，才能活得轻松。当我准备遗忘这些的时候，发现这些故事，竟然已不能轻易提及。）,拖行棺木的芬里尔Vol.05（一个被称为‘纳粹’的不死身魔男从阿根廷苏醒，背负着装有神秘少女的钢铁棺材一路步往美国西海岸，究竟会发生什么呢！） (轻小说系列),中国模式研究（谷臻小简·AI导读版）（对于中国模式的研究采取简单的赞成、回避或者消极应对态度都是不可取的，其背后实际是根本立场、观点和方法的分歧。）,溯源:中国传统文化之旅（谷臻小简·AI导读版）（中国传统文化丰富多彩，思想、政治、文化资源本自具足，是我们思想自信和文化自信的基石。）,法理学热点探析（谷臻小简·AI导读版）（本书分设法学理论、法与社会、法与经济、司法经纬四个专题，对法理学时事热点和理论前沿作了深入分析。）,建筑的七盏明灯（谷臻小简·AI导读版）（罗斯金认为建筑是从先辈手中继承下来的东西，并映射出先辈生活的景况。）,深秋一样忧伤的父亲（谷臻小简·AI导读版）（一部释放怀旧情结的散文集。一个一个童年故事，传递出朴实的人生习俗、情操与道德规范。）,关于人的思考（谷臻小简·AI导读版）（作者书中表达的遵循自然规律，实施因材施教的观点，对今天的教育仍具有重要的启发意义。）,不与醉汉讲道理（谷臻小简·AI导读版）（本书的每一篇文章都试图与醉汉讲讲道理，将他们从习焉不察中拉出半步，以避免沦为习惯与观念的奴隶，作者姬中宪在这本书中嬉笑怒骂，用时下最流行的语言，传递最反流行的观点，是醒酒汤，也是一剂猛药。）,领闲半步（谷臻小简·AI导读版）（为我国饭店业的同行相互借鉴、互相协助提供了一份学习材料，更是作者对我国饭店业作出的一大贡献。）,领闲半步（谷臻小简·AI导读版）（为我国饭店业的同行相互借鉴、互相协助提供了一份学习材料，更是作者对我国饭店业作出的一大贡献。）,领闲半步（谷臻小简·AI导读版）（为我国饭店业的同行相互借鉴、互相协助提供了一份学习材料，更是作者对我国饭店业作出的一大贡献。）,传统中国研究集刊.第12、13合辑（谷臻小简·AI导读版）（《传统中国研究集刊》由上海社会科学院历史研究所编纂，是一本有较高学术质量的不定期学术集刊。）,传统中国研究集刊.第12、13合辑（谷臻小简·AI导读版）（《传统中国研究集刊》由上海社会科学院历史研究所编纂，是一本有较高学术质量的不定期学术集刊。）,传统中国研究集刊.第12、13合辑（谷臻小简·AI导读版）（《传统中国研究集刊》由上海社会科学院历史研究所编纂，是一本有较高学术质量的不定期学术集刊。）,感受德意志（谷臻小简·AI导读版）（德国造就了世界上最杰出的哲学家、诗人、戏剧家和音乐家，让我们感受到德国诗意的浪漫和扑面而来的活力。）,感受德意志（谷臻小简·AI导读版）（德国造就了世界上最杰出的哲学家、诗人、戏剧家和音乐家，让我们感受到德国诗意的浪漫和扑面而来的活力。）,感受德意志（谷臻小简·AI导读版）（德国造就了世界上最杰出的哲学家、诗人、戏剧家和音乐家，让我们感受到德国诗意的浪漫和扑面而来的活力。）,拖行棺木的芬里尔Vol.02（一个被称为‘纳粹’的不死身魔男从阿根廷苏醒，背负着装有神秘少女的钢铁棺材一路步往美国西海岸，究竟会发生什么呢！） (轻小说系列),拖行棺木的芬里尔Vol.02（一个被称为‘纳粹’的不死身魔男从阿根廷苏醒，背负着装有神秘少女的钢铁棺材一路步往美国西海岸，究竟会发生什么呢！） (轻小说系列),拖行棺木的芬里尔Vol.02（一个被称为‘纳粹’的不死身魔男从阿根廷苏醒，背负着装有神秘少女的钢铁棺材一路步往美国西海岸，究竟会发生什么呢！） (轻小说系列),装甲少女艾丽卡（套装4册）（本应享受青春的少女们被送上战场对抗虫兽，日常的欢乐夹杂在血腥的战争之中，这是一部专属于少女们的物语……） (轻小说系列),装甲少女艾丽卡（套装4册）（本应享受青春的少女们被送上战场对抗虫兽，日常的欢乐夹杂在血腥的战争之中，这是一部专属于少女们的物语……） (轻小说系列),装甲少女艾丽卡（套装4册）（本应享受青春的少女们被送上战场对抗虫兽，日常的欢乐夹杂在血腥的战争之中，这是一部专属于少女们的物语……） (轻小说系列),我家聊斋不正经（一条千年白鲟鱼精，在大都市开始快乐地生活，溜溜弯，逛逛街，吵吵架，谈谈情……）,我家聊斋不正经（一条千年白鲟鱼精，在大都市开始快乐地生活，溜溜弯，逛逛街，吵吵架，谈谈情……）,我家聊斋不正经（一条千年白鲟鱼精，在大都市开始快乐地生活，溜溜弯，逛逛街，吵吵架，谈谈情……）,民族志：政治学科学化“手术刀”（谷臻小简·AI导读版）（这是一本专门研究田野研究的撰写文本“民族志”的论文汇集。
）,民族志：政治学科学化“手术刀”（谷臻小简·AI导读版）（这是一本专门研究田野研究的撰写文本“民族志”的论文汇集。
）,民族志：政治学科学化“手术刀”（谷臻小简·AI导读版）（这是一本专门研究田野研究的撰写文本“民族志”的论文汇集。
）,我不能再谈那些遗忘（谷臻小简·AI导读版）（35岁以后，我发现只有学会遗忘，才能活得轻松。当我准备遗忘这些的时候，发现这些故事，竟然已不能轻易提及。）,我不能再谈那些遗忘（谷臻小简·AI导读版）（35岁以后，我发现只有学会遗忘，才能活得轻松。当我准备遗忘这些的时候，发现这些故事，竟然已不能轻易提及。）,我不能再谈那些遗忘（谷臻小简·AI导读版）（35岁以后，我发现只有学会遗忘，才能活得轻松。当我准备遗忘这些的时候，发现这些故事，竟然已不能轻易提及。）,拖行棺木的芬里尔Vol.05（一个被称为‘纳粹’的不死身魔男从阿根廷苏醒，背负着装有神秘少女的钢铁棺材一路步往美国西海岸，究竟会发生什么呢！） (轻小说系列),拖行棺木的芬里尔Vol.05（一个被称为‘纳粹’的不死身魔男从阿根廷苏醒，背负着装有神秘少女的钢铁棺材一路步往美国西海岸，究竟会发生什么呢！） (轻小说系列),拖行棺木的芬里尔Vol.05（一个被称为‘纳粹’的不死身魔男从阿根廷苏醒，背负着装有神秘少女的钢铁棺材一路步往美国西海岸，究竟会发生什么呢！） (轻小说系列),中国模式研究（谷臻小简·AI导读版）（对于中国模式的研究采取简单的赞成、回避或者消极应对态度都是不可取的，其背后实际是根本立场、观点和方法的分歧。）,中国模式研究（谷臻小简·AI导读版）（对于中国模式的研究采取简单的赞成、回避或者消极应对态度都是不可取的，其背后实际是根本立场、观点和方法的分歧。）,中国模式研究（谷臻小简·AI导读版）（对于中国模式的研究采取简单的赞成、回避或者消极应对态度都是不可取的，其背后实际是根本立场、观点和方法的分歧。）,溯源:中国传统文化之旅（谷臻小简·AI导读版）（中国传统文化丰富多彩，思想、政治、文化资源本自具足，是我们思想自信和文化自信的基石。）,溯源:中国传统文化之旅（谷臻小简·AI导读版）（中国传统文化丰富多彩，思想、政治、文化资源本自具足，是我们思想自信和文化自信的基石。）,溯源:中国传统文化之旅（谷臻小简·AI导读版）（中国传统文化丰富多彩，思想、政治、文化资源本自具足，是我们思想自信和文化自信的基石。）,法理学热点探析（谷臻小简·AI导读版）（本书分设法学理论、法与社会、法与经济、司法经纬四个专题，对法理学时事热点和理论前沿作了深入分析。）,法理学热点探析（谷臻小简·AI导读版）（本书分设法学理论、法与社会、法与经济、司法经纬四个专题，对法理学时事热点和理论前沿作了深入分析。）,法理学热点探析（谷臻小简·AI导读版）（本书分设法学理论、法与社会、法与经济、司法经纬四个专题，对法理学时事热点和理论前沿作了深入分析。）,建筑的七盏明灯（谷臻小简·AI导读版）（罗斯金认为建筑是从先辈手中继承下来的东西，并映射出先辈生活的景况。）,建筑的七盏明灯（谷臻小简·AI导读版）（罗斯金认为建筑是从先辈手中继承下来的东西，并映射出先辈生活的景况。）,建筑的七盏明灯（谷臻小简·AI导读版）（罗斯金认为建筑是从先辈手中继承下来的东西，并映射出先辈生活的景况。）,深秋一样忧伤的父亲（谷臻小简·AI导读版）（一部释放怀旧情结的散文集。一个一个童年故事，传递出朴实的人生习俗、情操与道德规范。）,深秋一样忧伤的父亲（谷臻小简·AI导读版）（一部释放怀旧情结的散文集。一个一个童年故事，传递出朴实的人生习俗、情操与道德规范。）,深秋一样忧伤的父亲（谷臻小简·AI导读版）（一部释放怀旧情结的散文集。一个一个童年故事，传递出朴实的人生习俗、情操与道德规范。）,关于人的思考（谷臻小简·AI导读版）（作者书中表达的遵循自然规律，实施因材施教的观点，对今天的教育仍具有重要的启发意义。）,关于人的思考（谷臻小简·AI导读版）（作者书中表达的遵循自然规律，实施因材施教的观点，对今天的教育仍具有重要的启发意义。）,关于人的思考（谷臻小简·AI导读版）（作者书中表达的遵循自然规律，实施因材施教的观点，对今天的教育仍具有重要的启发意义。）,不与醉汉讲道理（谷臻小简·AI导读版）（本书的每一篇文章都试图与醉汉讲讲道理，将他们从习焉不察中拉出半步，以避免沦为习惯与观念的奴隶，作者姬中宪在这本书中嬉笑怒骂，用时下最流行的语言，传递最反流行的观点，是醒酒汤，也是一剂猛药。）,不与醉汉讲道理（谷臻小简·AI导读版）（本书的每一篇文章都试图与醉汉讲讲道理，将他们从习焉不察中拉出半步，以避免沦为习惯与观念的奴隶，作者姬中宪在这本书中嬉笑怒骂，用时下最流行的语言，传递最反流行的观点，是醒酒汤，也是一剂猛药。）,不与醉汉讲道理（谷臻小简·AI导读版）（本书的每一篇文章都试图与醉汉讲讲道理，将他们从习焉不察中拉出半步，以避免沦为习惯与观念的奴隶，作者姬中宪在这本书中嬉笑怒骂，用时下最流行的语言，传递最反流行的观点，是醒酒汤，也是一剂猛药。）"
,,,"用年表读通中国史 (中华书局出品),环球国家地理百科全书：第二卷,未来的飞机（谷臻小简·AI导读版）（介绍各种各具特色的交通设备）,母婴营养百科全书,军事技术知识篇（上） (科普知识百科全书 1),军事技术知识篇（下） (科普知识百科全书 2),中华文化年表（精） (中华书局出品),经典常谈 (国风书系),中国文学史年表 (中华书局出品),沙乡年鉴(与《瓦尔登湖》相媲美，并誉为自然文学典范 、生态文学的圣经。曾被美国纽约公共图书馆评为“20世纪自然写作领域十大好书之一),微生物知识篇 (科普知识百科全书 60),养生保健百科全书：全2册 (中国家庭必备养生保健工具书),2015全球翡翠拍卖年鉴 (薄本) (紫图),藏文规范音节频率词典,中国历史学年鉴（2002～2012）,《东吴学术》年谱丛书:余华文学年谱,用年表读通中国史 (中华书局出品),用年表读通中国史 (中华书局出品),用年表读通中国史 (中华书局出品),环球国家地理百科全书：第二卷,环球国家地理百科全书：第二卷,环球国家地理百科全书：第二卷,未来的飞机（谷臻小简·AI导读版）（介绍各种各具特色的交通设备）,未来的飞机（谷臻小简·AI导读版）（介绍各种各具特色的交通设备）,未来的飞机（谷臻小简·AI导读版）（介绍各种各具特色的交通设备）,母婴营养百科全书,母婴营养百科全书,母婴营养百科全书,军事技术知识篇（上） (科普知识百科全书 1),军事技术知识篇（上） (科普知识百科全书 1),军事技术知识篇（上） (科普知识百科全书 1),军事技术知识篇（下） (科普知识百科全书 2),军事技术知识篇（下） (科普知识百科全书 2),军事技术知识篇（下） (科普知识百科全书 2),中华文化年表（精） (中华书局出品),中华文化年表（精） (中华书局出品),中华文化年表（精） (中华书局出品),经典常谈 (国风书系),经典常谈 (国风书系),经典常谈 (国风书系),中国文学史年表 (中华书局出品),中国文学史年表 (中华书局出品),中国文学史年表 (中华书局出品),沙乡年鉴(与《瓦尔登湖》相媲美，并誉为自然文学典范 、生态文学的圣经。曾被美国纽约公共图书馆评为“20世纪自然写作领域十大好书之一),沙乡年鉴(与《瓦尔登湖》相媲美，并誉为自然文学典范 、生态文学的圣经。曾被美国纽约公共图书馆评为“20世纪自然写作领域十大好书之一),沙乡年鉴(与《瓦尔登湖》相媲美，并誉为自然文学典范 、生态文学的圣经。曾被美国纽约公共图书馆评为“20世纪自然写作领域十大好书之一),微生物知识篇 (科普知识百科全书 60),微生物知识篇 (科普知识百科全书 60),微生物知识篇 (科普知识百科全书 60),养生保健百科全书：全2册 (中国家庭必备养生保健工具书),养生保健百科全书：全2册 (中国家庭必备养生保健工具书),养生保健百科全书：全2册 (中国家庭必备养生保健工具书),2015全球翡翠拍卖年鉴 (薄本) (紫图),2015全球翡翠拍卖年鉴 (薄本) (紫图),2015全球翡翠拍卖年鉴 (薄本) (紫图),藏文规范音节频率词典,藏文规范音节频率词典,藏文规范音节频率词典,中国历史学年鉴（2002～2012）,中国历史学年鉴（2002～2012）,中国历史学年鉴（2002～2012）,《东吴学术》年谱丛书:余华文学年谱,《东吴学术》年谱丛书:余华文学年谱,《东吴学术》年谱丛书:余华文学年谱"
,,,"专家诊治子宫疾病（谷臻小简·AI导读版）（这是一本与子宫疾病有关的集了解、诊断、治疗、预防于一体的专业书籍。）,母婴护理百科全书,上海故事·增刊 半年刊 2012年01期,中国企业最常用的组织战略管理工具 (首部为中国企业量身定制的管理工具书，高效经理人的案头必备宝典。),中华句典2(经典珍藏版),刑具淫威（下） (中国历史百科 33),专家诊治眩晕症（谷臻小简·AI导读版）（眩晕症不可小觑，了解它从这里开始）,专家解答月经失调（谷臻小简·AI导读版）（从专业角度系统分析解答了月经失调的起因以及治疗方法）,祖先的脸谱（谷臻小简·AI导读版）（一本讲述中华文明出现和文化演变的书籍。远古的密码究竟暗含着什么奥秘玄机呢？）,植物知识篇（上） (科普知识百科全书 42),你在为谁工作：一本重燃工作激情实现自我突破的梦想工具书，从月薪3000元到年薪100万元的职场做事秘笈 (时光新文库),新版痛风病疗法与有效食疗（谷臻小简·AI导读版）（让你了解如何通过食疗来改善通风病）,振宇锐智·中国汉字听写手册：高级-向中国魅力汉字致敬-词典题库精选,养生睡眠（谷臻小简·AI导读版）（让你了解与睡眠有关的养生知识）,圣经地名词典（英汉对照）,专家整治妇科肿瘤（谷臻小简·AI导读版）（一本能帮助你全面系统地正确认识妇科肿瘤的书）,专家诊治子宫疾病（谷臻小简·AI导读版）（这是一本与子宫疾病有关的集了解、诊断、治疗、预防于一体的专业书籍。）,专家诊治子宫疾病（谷臻小简·AI导读版）（这是一本与子宫疾病有关的集了解、诊断、治疗、预防于一体的专业书籍。）,专家诊治子宫疾病（谷臻小简·AI导读版）（这是一本与子宫疾病有关的集了解、诊断、治疗、预防于一体的专业书籍。）,母婴护理百科全书,母婴护理百科全书,母婴护理百科全书,上海故事·增刊 半年刊 2012年01期,上海故事·增刊 半年刊 2012年01期,上海故事·增刊 半年刊 2012年01期,中国企业最常用的组织战略管理工具 (首部为中国企业量身定制的管理工具书，高效经理人的案头必备宝典。),中国企业最常用的组织战略管理工具 (首部为中国企业量身定制的管理工具书，高效经理人的案头必备宝典。),中国企业最常用的组织战略管理工具 (首部为中国企业量身定制的管理工具书，高效经理人的案头必备宝典。),中华句典2(经典珍藏版),中华句典2(经典珍藏版),中华句典2(经典珍藏版),刑具淫威（下） (中国历史百科 33),刑具淫威（下） (中国历史百科 33),刑具淫威（下） (中国历史百科 33),专家诊治眩晕症（谷臻小简·AI导读版）（眩晕症不可小觑，了解它从这里开始）,专家诊治眩晕症（谷臻小简·AI导读版）（眩晕症不可小觑，了解它从这里开始）,专家诊治眩晕症（谷臻小简·AI导读版）（眩晕症不可小觑，了解它从这里开始）,专家解答月经失调（谷臻小简·AI导读版）（从专业角度系统分析解答了月经失调的起因以及治疗方法）,专家解答月经失调（谷臻小简·AI导读版）（从专业角度系统分析解答了月经失调的起因以及治疗方法）,专家解答月经失调（谷臻小简·AI导读版）（从专业角度系统分析解答了月经失调的起因以及治疗方法）,祖先的脸谱（谷臻小简·AI导读版）（一本讲述中华文明出现和文化演变的书籍。远古的密码究竟暗含着什么奥秘玄机呢？）,祖先的脸谱（谷臻小简·AI导读版）（一本讲述中华文明出现和文化演变的书籍。远古的密码究竟暗含着什么奥秘玄机呢？）,祖先的脸谱（谷臻小简·AI导读版）（一本讲述中华文明出现和文化演变的书籍。远古的密码究竟暗含着什么奥秘玄机呢？）,植物知识篇（上） (科普知识百科全书 42),植物知识篇（上） (科普知识百科全书 42),植物知识篇（上） (科普知识百科全书 42),你在为谁工作：一本重燃工作激情实现自我突破的梦想工具书，从月薪3000元到年薪100万元的职场做事秘笈 (时光新文库),你在为谁工作：一本重燃工作激情实现自我突破的梦想工具书，从月薪3000元到年薪100万元的职场做事秘笈 (时光新文库),你在为谁工作：一本重燃工作激情实现自我突破的梦想工具书，从月薪3000元到年薪100万元的职场做事秘笈 (时光新文库),新版痛风病疗法与有效食疗（谷臻小简·AI导读版）（让你了解如何通过食疗来改善通风病）,新版痛风病疗法与有效食疗（谷臻小简·AI导读版）（让你了解如何通过食疗来改善通风病）,新版痛风病疗法与有效食疗（谷臻小简·AI导读版）（让你了解如何通过食疗来改善通风病）,振宇锐智·中国汉字听写手册：高级-向中国魅力汉字致敬-词典题库精选,振宇锐智·中国汉字听写手册：高级-向中国魅力汉字致敬-词典题库精选,振宇锐智·中国汉字听写手册：高级-向中国魅力汉字致敬-词典题库精选,养生睡眠（谷臻小简·AI导读版）（让你了解与睡眠有关的养生知识）,养生睡眠（谷臻小简·AI导读版）（让你了解与睡眠有关的养生知识）,养生睡眠（谷臻小简·AI导读版）（让你了解与睡眠有关的养生知识）,圣经地名词典（英汉对照）,圣经地名词典（英汉对照）,圣经地名词典（英汉对照）,专家整治妇科肿瘤（谷臻小简·AI导读版）（一本能帮助你全面系统地正确认识妇科肿瘤的书）,专家整治妇科肿瘤（谷臻小简·AI导读版）（一本能帮助你全面系统地正确认识妇科肿瘤的书）,专家整治妇科肿瘤（谷臻小简·AI导读版）（一本能帮助你全面系统地正确认识妇科肿瘤的书）"
