author,publish_time,rates,title
,,,"装甲少女艾丽卡Vol.04（本应享受青春的少女们被送上战场对抗虫兽，日常的欢乐夹杂在血腥的战争之中，这是一部专属于少女们的物语……） (轻小说系列),舍管、匿于魔女学院之巅Vol.03（试验型当代女子魔法高中生圈养实践论） (轻小说系列),装甲少女艾丽卡Vol.01（本应享受青春的少女们被送上战场对抗虫兽，日常的欢乐夹杂在血腥的战争之中，这是一部专属于少女们的物语……） (轻小说系列),装甲少女艾丽卡Vol.02（本应享受青春的少女们被送上战场对抗虫兽，日常的欢乐夹杂在血腥的战争之中，这是一部专属于少女们的物语……） (轻小说系列),舍管、匿于魔女学院之巅Vol.02（试验型当代女子魔法高中生圈养实践论） (轻小说系列),装甲少女艾丽卡Vol.03（本应享受青春的少女们被送上战场对抗虫兽，日常的欢乐夹杂在血腥的战争之中，这是一部专属于少女们的物语……） (轻小说系列),法学理论前沿（谷臻小简·AI导读版）（本书是上海社会科学院哲学社会科学创新工程学术前沿丛书中的一本，聚焦和探索十八大以来我国社会主义法治建设的重要进展，深入研究依法治国的重大理论问题和实践问题。）,装甲少女艾丽卡Vol.04（本应享受青春的少女们被送上战场对抗虫兽，日常的欢乐夹杂在血腥的战争之中，这是一部专属于少女们的物语……） (轻小说系列),装甲少女艾丽卡Vol.04（本应享受青春的少女们被送上战场对抗虫兽，日常的欢乐夹杂在血腥的战争之中，这是一部专属于少女们的物语……） (轻小说系列),装甲少女艾丽卡Vol.04（本应享受青春的少女们被送上战场对抗虫兽，日常的欢乐夹杂在血腥的战争之中，这是一部专属于少女们的物语……） (轻小说系列),舍管、匿于魔女学院之巅Vol.03（试验型当代女子魔法高中生圈养实践论） (轻小说系列),舍管、匿于魔女学院之巅Vol.03（试验型当代女子魔法高中生圈养实践论） (轻小说系列),舍管、匿于魔女学院之巅Vol.03（试验型当代女子魔法高中生圈养实践论） (轻小说系列),装甲少女艾丽卡Vol.01（本应享受青春的少女们被送上战场对抗虫兽，日常的欢乐夹杂在血腥的战争之中，这是一部专属于少女们的物语……） (轻小说系列),装甲少女艾丽卡Vol.01（本应享受青春的少女们被送上战场对抗虫兽，日常的欢乐夹杂在血腥的战争之中，这是一部专属于少女们的物语……） (轻小说系列),装甲少女艾丽卡Vol.01（本应享受青春的少女们被送上战场对抗虫兽，日常的欢乐夹杂在血腥的战争之中，这是一部专属于少女们的物语……） (轻小说系列),装甲少女艾丽卡Vol.02（本应享受青春的少女们被送上战场对抗虫兽，日常的欢乐夹杂在血腥的战争之中，这是一部专属于少女们的物语……） (轻小说系列),装甲少女艾丽卡Vol.02（本应享受青春的少女们被送上战场对抗虫兽，日常的欢乐夹杂在血腥的战争之中，这是一部专属于少女们的物语……） (轻小说系列),装甲少女艾丽卡Vol.02（本应享受青春的少女们被送上战场对抗虫兽，日常的欢乐夹杂在血腥的战争之中，这是一部专属于少女们的物语……） (轻小说系列),舍管、匿于魔女学院之巅Vol.02（试验型当代女子魔法高中生圈养实践论） (轻小说系列),舍管、匿于魔女学院之巅Vol.02（试验型当代女子魔法高中生圈养实践论） (轻小说系列),舍管、匿于魔女学院之巅Vol.02（试验型当代女子魔法高中生圈养实践论） (轻小说系列),装甲少女艾丽卡Vol.03（本应享受青春的少女们被送上战场对抗虫兽，日常的欢乐夹杂在血腥的战争之中，这是一部专属于少女们的物语……） (轻小说系列),装甲少女艾丽卡Vol.03（本应享受青春的少女们被送上战场对抗虫兽，日常的欢乐夹杂在血腥的战争之中，这是一部专属于少女们的物语……） (轻小说系列),装甲少女艾丽卡Vol.03（本应享受青春的少女们被送上战场对抗虫兽，日常的欢乐夹杂在血腥的战争之中，这是一部专属于少女们的物语……） (轻小说系列),法学理论前沿（谷臻小简·AI导读版）（本书是上海社会科学院哲学社会科学创新工程学术前沿丛书中的一本，聚焦和探索十八大以来我国社会主义法治建设的重要进展，深入研究依法治国的重大理论问题和实践问题。）,法学理论前沿（谷臻小简·AI导读版）（本书是上海社会科学院哲学社会科学创新工程学术前沿丛书中的一本，聚焦和探索十八大以来我国社会主义法治建设的重要进展，深入研究依法治国的重大理论问题和实践问题。）,法学理论前沿（谷臻小简·AI导读版）（本书是上海社会科学院哲学社会科学创新工程学术前沿丛书中的一本，聚焦和探索十八大以来我国社会主义法治建设的重要进展，深入研究依法治国的重大理论问题和实践问题。）"
,,,"专家诊治男科疾病（谷臻小简·AI导读版）（这是一本关于男性疾病诊治情况的书）,专家诊治贫血（谷臻小简·AI导读版）（一本书让您了解诊治贫血有关知识）,农业园艺知识篇（上） (科普知识百科全书 3),王安石年谱长编（第1册） (中华书局出品),世界著名神话故事,同步育儿早教大百科全书 (之宝贝书系),水知识篇（下） (科普知识百科全书 28),上海故事·增刊 半年刊 2013年01期,新编超实用家庭万年历(2014年),王安石年谱长编（第2册） (中华书局出品),专家诊治下肢血管病（谷臻小简·AI导读版）（下肢血管疾病的介绍及早期预防）,中国融资租赁业年鉴（2013年卷） (中国租赁蓝皮书),手绘POP实用词典——创意字体速查,地球守卫者：自然保护区和国家公园概览 (中国大百科全书普及版),特洛伊（谷臻小简·AI导读版）（本书从对特洛伊战争的描写入手，一步步展现出古希腊文明的辉煌历史）,专家诊治冠心病（谷臻小简·AI导读版）（冠心病的发病机制，中西医的治疗方法和健康保健）,专家诊治男科疾病（谷臻小简·AI导读版）（这是一本关于男性疾病诊治情况的书）,专家诊治男科疾病（谷臻小简·AI导读版）（这是一本关于男性疾病诊治情况的书）,专家诊治男科疾病（谷臻小简·AI导读版）（这是一本关于男性疾病诊治情况的书）,专家诊治贫血（谷臻小简·AI导读版）（一本书让您了解诊治贫血有关知识）,专家诊治贫血（谷臻小简·AI导读版）（一本书让您了解诊治贫血有关知识）,专家诊治贫血（谷臻小简·AI导读版）（一本书让您了解诊治贫血有关知识）,农业园艺知识篇（上） (科普知识百科全书 3),农业园艺知识篇（上） (科普知识百科全书 3),农业园艺知识篇（上） (科普知识百科全书 3),王安石年谱长编（第1册） (中华书局出品),王安石年谱长编（第1册） (中华书局出品),王安石年谱长编（第1册） (中华书局出品),世界著名神话故事,世界著名神话故事,世界著名神话故事,同步育儿早教大百科全书 (之宝贝书系),同步育儿早教大百科全书 (之宝贝书系),同步育儿早教大百科全书 (之宝贝书系),水知识篇（下） (科普知识百科全书 28),水知识篇（下） (科普知识百科全书 28),水知识篇（下） (科普知识百科全书 28),上海故事·增刊 半年刊 2013年01期,上海故事·增刊 半年刊 2013年01期,上海故事·增刊 半年刊 2013年01期,新编超实用家庭万年历(2014年),新编超实用家庭万年历(2014年),新编超实用家庭万年历(2014年),王安石年谱长编（第2册） (中华书局出品),王安石年谱长编（第2册） (中华书局出品),王安石年谱长编（第2册） (中华书局出品),专家诊治下肢血管病（谷臻小简·AI导读版）（下肢血管疾病的介绍及早期预防）,专家诊治下肢血管病（谷臻小简·AI导读版）（下肢血管疾病的介绍及早期预防）,专家诊治下肢血管病（谷臻小简·AI导读版）（下肢血管疾病的介绍及早期预防）,中国融资租赁业年鉴（2013年卷） (中国租赁蓝皮书),中国融资租赁业年鉴（2013年卷） (中国租赁蓝皮书),中国融资租赁业年鉴（2013年卷） (中国租赁蓝皮书),手绘POP实用词典——创意字体速查,手绘POP实用词典——创意字体速查,手绘POP实用词典——创意字体速查,地球守卫者：自然保护区和国家公园概览 (中国大百科全书普及版),地球守卫者：自然保护区和国家公园概览 (中国大百科全书普及版),地球守卫者：自然保护区和国家公园概览 (中国大百科全书普及版),特洛伊（谷臻小简·AI导读版）（本书从对特洛伊战争的描写入手，一步步展现出古希腊文明的辉煌历史）,特洛伊（谷臻小简·AI导读版）（本书从对特洛伊战争的描写入手，一步步展现出古希腊文明的辉煌历史）,特洛伊（谷臻小简·AI导读版）（本书从对特洛伊战争的描写入手，一步步展现出古希腊文明的辉煌历史）,专家诊治冠心病（谷臻小简·AI导读版）（冠心病的发病机制，中西医的治疗方法和健康保健）,专家诊治冠心病（谷臻小简·AI导读版）（冠心病的发病机制，中西医的治疗方法和健康保健）,专家诊治冠心病（谷臻小简·AI导读版）（冠心病的发病机制，中西医的治疗方法和健康保健）"
,,,"阉宦兴衰（上） (中国历史百科 34),赫赫天朝（下） (中国历史百科 15),大事录要（下） (中国历史百科 7),谈闲说怪（上） (中国历史百科 28),优伶春秋（上） (中国历史百科 40),疑案寻踪（上） (中国历史百科 36),国门内外（上） (中国历史百科 12),黄埔军校年谱长编,典籍源流（下） (中国历史百科 9),史籍精华（下） (中国历史百科 27),国门内外（下） (中国历史百科 13),疑案寻踪（下） (中国历史百科 37),状元全录（上） (中国历史百科 42),阉宦兴衰（下） (中国历史百科 35),青史垂名（上） (中国历史百科 22),状元全录（下） (中国历史百科 43),阉宦兴衰（上） (中国历史百科 34),阉宦兴衰（上） (中国历史百科 34),阉宦兴衰（上） (中国历史百科 34),赫赫天朝（下） (中国历史百科 15),赫赫天朝（下） (中国历史百科 15),赫赫天朝（下） (中国历史百科 15),大事录要（下） (中国历史百科 7),大事录要（下） (中国历史百科 7),大事录要（下） (中国历史百科 7),谈闲说怪（上） (中国历史百科 28),谈闲说怪（上） (中国历史百科 28),谈闲说怪（上） (中国历史百科 28),优伶春秋（上） (中国历史百科 40),优伶春秋（上） (中国历史百科 40),优伶春秋（上） (中国历史百科 40),疑案寻踪（上） (中国历史百科 36),疑案寻踪（上） (中国历史百科 36),疑案寻踪（上） (中国历史百科 36),国门内外（上） (中国历史百科 12),国门内外（上） (中国历史百科 12),国门内外（上） (中国历史百科 12),黄埔军校年谱长编,黄埔军校年谱长编,黄埔军校年谱长编,典籍源流（下） (中国历史百科 9),典籍源流（下） (中国历史百科 9),典籍源流（下） (中国历史百科 9),史籍精华（下） (中国历史百科 27),史籍精华（下） (中国历史百科 27),史籍精华（下） (中国历史百科 27),国门内外（下） (中国历史百科 13),国门内外（下） (中国历史百科 13),国门内外（下） (中国历史百科 13),疑案寻踪（下） (中国历史百科 37),疑案寻踪（下） (中国历史百科 37),疑案寻踪（下） (中国历史百科 37),状元全录（上） (中国历史百科 42),状元全录（上） (中国历史百科 42),状元全录（上） (中国历史百科 42),阉宦兴衰（下） (中国历史百科 35),阉宦兴衰（下） (中国历史百科 35),阉宦兴衰（下） (中国历史百科 35),青史垂名（上） (中国历史百科 22),青史垂名（上） (中国历史百科 22),青史垂名（上） (中国历史百科 22),状元全录（下） (中国历史百科 43),状元全录（下） (中国历史百科 43),状元全录（下） (中国历史百科 43)"
,,,"阉宦兴衰（上） (中国历史百科 34),赫赫天朝（下） (中国历史百科 15),大事录要（下） (中国历史百科 7),谈闲说怪（上） (中国历史百科 28),优伶春秋（上） (中国历史百科 40),疑案寻踪（上） (中国历史百科 36),国门内外（上） (中国历史百科 12),黄埔军校年谱长编,典籍源流（下） (中国历史百科 9),史籍精华（下） (中国历史百科 27),国门内外（下） (中国历史百科 13),疑案寻踪（下） (中国历史百科 37),状元全录（上） (中国历史百科 42),阉宦兴衰（下） (中国历史百科 35),青史垂名（上） (中国历史百科 22),状元全录（下） (中国历史百科 43),阉宦兴衰（上） (中国历史百科 34),阉宦兴衰（上） (中国历史百科 34),阉宦兴衰（上） (中国历史百科 34),赫赫天朝（下） (中国历史百科 15),赫赫天朝（下） (中国历史百科 15),赫赫天朝（下） (中国历史百科 15),大事录要（下） (中国历史百科 7),大事录要（下） (中国历史百科 7),大事录要（下） (中国历史百科 7),谈闲说怪（上） (中国历史百科 28),谈闲说怪（上） (中国历史百科 28),谈闲说怪（上） (中国历史百科 28),优伶春秋（上） (中国历史百科 40),优伶春秋（上） (中国历史百科 40),优伶春秋（上） (中国历史百科 40),疑案寻踪（上） (中国历史百科 36),疑案寻踪（上） (中国历史百科 36),疑案寻踪（上） (中国历史百科 36),国门内外（上） (中国历史百科 12),国门内外（上） (中国历史百科 12),国门内外（上） (中国历史百科 12),黄埔军校年谱长编,黄埔军校年谱长编,黄埔军校年谱长编,典籍源流（下） (中国历史百科 9),典籍源流（下） (中国历史百科 9),典籍源流（下） (中国历史百科 9),史籍精华（下） (中国历史百科 27),史籍精华（下） (中国历史百科 27),史籍精华（下） (中国历史百科 27),国门内外（下） (中国历史百科 13),国门内外（下） (中国历史百科 13),国门内外（下） (中国历史百科 13),疑案寻踪（下） (中国历史百科 37),疑案寻踪（下） (中国历史百科 37),疑案寻踪（下） (中国历史百科 37),状元全录（上） (中国历史百科 42),状元全录（上） (中国历史百科 42),状元全录（上） (中国历史百科 42),阉宦兴衰（下） (中国历史百科 35),阉宦兴衰（下） (中国历史百科 35),阉宦兴衰（下） (中国历史百科 35),青史垂名（上） (中国历史百科 22),青史垂名（上） (中国历史百科 22),青史垂名（上） (中国历史百科 22),状元全录（下） (中国历史百科 43),状元全录（下） (中国历史百科 43),状元全录（下） (中国历史百科 43)"
,,,"环球国家地理百科全书：第九卷,环球国家地理百科全书：第七卷,多语种水力机械词汇（中－英－西）,365天读点经典,自己是最好的医生全书 (中国家庭必备工具书),卓越HR必备工具书：企业用工风险防范实务操作与案例精解 (HR必备丛书),Excel公式与函数大辞典,中华传统语典,百病食疗大全（彩图精装） (中国家庭必备工具书),家庭亲密育儿法(新浪、搜狐名博博主玛希娅10年北美家庭教育研究成果，融合国际视野和教育新知的育儿工具书),小穴位大健康全书 (中国家庭必备工具书),2015全球杂项拍卖年鉴 (紫图),灸除百病刮痧保健全书：彩图白金版 (中国家庭必备工具书),字里行间文库025：经典常谈 (百年经典学术丛刊),桓谭年谱 (中国社会科学院文学研究所学术文库),《黄帝内经》养生智慧全书 (中国家庭必备工具书),环球国家地理百科全书：第九卷,环球国家地理百科全书：第九卷,环球国家地理百科全书：第九卷,环球国家地理百科全书：第七卷,环球国家地理百科全书：第七卷,环球国家地理百科全书：第七卷,多语种水力机械词汇（中－英－西）,多语种水力机械词汇（中－英－西）,多语种水力机械词汇（中－英－西）,365天读点经典,365天读点经典,365天读点经典,自己是最好的医生全书 (中国家庭必备工具书),自己是最好的医生全书 (中国家庭必备工具书),自己是最好的医生全书 (中国家庭必备工具书),卓越HR必备工具书：企业用工风险防范实务操作与案例精解 (HR必备丛书),卓越HR必备工具书：企业用工风险防范实务操作与案例精解 (HR必备丛书),卓越HR必备工具书：企业用工风险防范实务操作与案例精解 (HR必备丛书),Excel公式与函数大辞典,Excel公式与函数大辞典,Excel公式与函数大辞典,中华传统语典,中华传统语典,中华传统语典,百病食疗大全（彩图精装） (中国家庭必备工具书),百病食疗大全（彩图精装） (中国家庭必备工具书),百病食疗大全（彩图精装） (中国家庭必备工具书),家庭亲密育儿法(新浪、搜狐名博博主玛希娅10年北美家庭教育研究成果，融合国际视野和教育新知的育儿工具书),家庭亲密育儿法(新浪、搜狐名博博主玛希娅10年北美家庭教育研究成果，融合国际视野和教育新知的育儿工具书),家庭亲密育儿法(新浪、搜狐名博博主玛希娅10年北美家庭教育研究成果，融合国际视野和教育新知的育儿工具书),小穴位大健康全书 (中国家庭必备工具书),小穴位大健康全书 (中国家庭必备工具书),小穴位大健康全书 (中国家庭必备工具书),2015全球杂项拍卖年鉴 (紫图),2015全球杂项拍卖年鉴 (紫图),2015全球杂项拍卖年鉴 (紫图),灸除百病刮痧保健全书：彩图白金版 (中国家庭必备工具书),灸除百病刮痧保健全书：彩图白金版 (中国家庭必备工具书),灸除百病刮痧保健全书：彩图白金版 (中国家庭必备工具书),字里行间文库025：经典常谈 (百年经典学术丛刊),字里行间文库025：经典常谈 (百年经典学术丛刊),字里行间文库025：经典常谈 (百年经典学术丛刊),桓谭年谱 (中国社会科学院文学研究所学术文库),桓谭年谱 (中国社会科学院文学研究所学术文库),桓谭年谱 (中国社会科学院文学研究所学术文库),《黄帝内经》养生智慧全书 (中国家庭必备工具书),《黄帝内经》养生智慧全书 (中国家庭必备工具书),《黄帝内经》养生智慧全书 (中国家庭必备工具书)"
,,,"翻翻书，三个月怀上好宝宝,药用真菌治肿瘤 (千菌方系列),糖尿病治疗与保养大全(超值白金版),王雨三治病法轨 (中医师承学堂),中里巴人健康私房话 (求医不如求己系列四),阿特金斯饮食法：6周低卡瘦身计划（颠覆传统的瘦身理念，风靡数载的美食秘籍）,抑郁症 (俗见新解译丛),《伤寒论》方医案选 (经方研习书系),养生必知的饮食宜忌 (国医绝学健康馆),药征 (中国古医籍整理丛书·本草),女人不生病的纪律,神经内科临床处方手册(第二版) (临床处方丛书),内科学精粹,家庭医生,火神：郑钦安 (火神派著名医家系列丛书),女人调血补血宝典:要美丽先养血,翻翻书，三个月怀上好宝宝,翻翻书，三个月怀上好宝宝,翻翻书，三个月怀上好宝宝,药用真菌治肿瘤 (千菌方系列),药用真菌治肿瘤 (千菌方系列),药用真菌治肿瘤 (千菌方系列),糖尿病治疗与保养大全(超值白金版),糖尿病治疗与保养大全(超值白金版),糖尿病治疗与保养大全(超值白金版),王雨三治病法轨 (中医师承学堂),王雨三治病法轨 (中医师承学堂),王雨三治病法轨 (中医师承学堂),中里巴人健康私房话 (求医不如求己系列四),中里巴人健康私房话 (求医不如求己系列四),中里巴人健康私房话 (求医不如求己系列四),阿特金斯饮食法：6周低卡瘦身计划（颠覆传统的瘦身理念，风靡数载的美食秘籍）,阿特金斯饮食法：6周低卡瘦身计划（颠覆传统的瘦身理念，风靡数载的美食秘籍）,阿特金斯饮食法：6周低卡瘦身计划（颠覆传统的瘦身理念，风靡数载的美食秘籍）,抑郁症 (俗见新解译丛),抑郁症 (俗见新解译丛),抑郁症 (俗见新解译丛),《伤寒论》方医案选 (经方研习书系),《伤寒论》方医案选 (经方研习书系),《伤寒论》方医案选 (经方研习书系),养生必知的饮食宜忌 (国医绝学健康馆),养生必知的饮食宜忌 (国医绝学健康馆),养生必知的饮食宜忌 (国医绝学健康馆),药征 (中国古医籍整理丛书·本草),药征 (中国古医籍整理丛书·本草),药征 (中国古医籍整理丛书·本草),女人不生病的纪律,女人不生病的纪律,女人不生病的纪律,神经内科临床处方手册(第二版) (临床处方丛书),神经内科临床处方手册(第二版) (临床处方丛书),神经内科临床处方手册(第二版) (临床处方丛书),内科学精粹,内科学精粹,内科学精粹,家庭医生,家庭医生,家庭医生,火神：郑钦安 (火神派著名医家系列丛书),火神：郑钦安 (火神派著名医家系列丛书),火神：郑钦安 (火神派著名医家系列丛书),女人调血补血宝典:要美丽先养血,女人调血补血宝典:要美丽先养血,女人调血补血宝典:要美丽先养血"
,,,"慢性咽炎 (健康教育丛书),颈椎病防治一本通 (常见病防治丛书),与自己和解:用禅的智慧治疗神经症,心理亚健康解决方案：自我催眠技术实战应用,江南美食养生谭 (浙商院文库),专家推荐的养胃食谱158例 (美食坊),伤寒明理论 (中国经典文库),黄帝内经灵枢三家注·下编 (灵兰书院·中医经典三家注系列),孕期40周营养看这本就够了 (孕产一本就够系列),前列腺病实用自我疗法 (实用自我疗法系列),中医薪传 (张义尚先生编著系列),你吃对了吗?,自我治疗前列腺炎 (求医更要求己丛书),脊椎养护完全手册 (中医养生系列),脱发 (健康教育丛书(40)),针灸解惑,慢性咽炎 (健康教育丛书),慢性咽炎 (健康教育丛书),慢性咽炎 (健康教育丛书),颈椎病防治一本通 (常见病防治丛书),颈椎病防治一本通 (常见病防治丛书),颈椎病防治一本通 (常见病防治丛书),与自己和解:用禅的智慧治疗神经症,与自己和解:用禅的智慧治疗神经症,与自己和解:用禅的智慧治疗神经症,心理亚健康解决方案：自我催眠技术实战应用,心理亚健康解决方案：自我催眠技术实战应用,心理亚健康解决方案：自我催眠技术实战应用,江南美食养生谭 (浙商院文库),江南美食养生谭 (浙商院文库),江南美食养生谭 (浙商院文库),专家推荐的养胃食谱158例 (美食坊),专家推荐的养胃食谱158例 (美食坊),专家推荐的养胃食谱158例 (美食坊),伤寒明理论 (中国经典文库),伤寒明理论 (中国经典文库),伤寒明理论 (中国经典文库),黄帝内经灵枢三家注·下编 (灵兰书院·中医经典三家注系列),黄帝内经灵枢三家注·下编 (灵兰书院·中医经典三家注系列),黄帝内经灵枢三家注·下编 (灵兰书院·中医经典三家注系列),孕期40周营养看这本就够了 (孕产一本就够系列),孕期40周营养看这本就够了 (孕产一本就够系列),孕期40周营养看这本就够了 (孕产一本就够系列),前列腺病实用自我疗法 (实用自我疗法系列),前列腺病实用自我疗法 (实用自我疗法系列),前列腺病实用自我疗法 (实用自我疗法系列),中医薪传 (张义尚先生编著系列),中医薪传 (张义尚先生编著系列),中医薪传 (张义尚先生编著系列),你吃对了吗?,你吃对了吗?,你吃对了吗?,自我治疗前列腺炎 (求医更要求己丛书),自我治疗前列腺炎 (求医更要求己丛书),自我治疗前列腺炎 (求医更要求己丛书),脊椎养护完全手册 (中医养生系列),脊椎养护完全手册 (中医养生系列),脊椎养护完全手册 (中医养生系列),脱发 (健康教育丛书(40)),脱发 (健康教育丛书(40)),脱发 (健康教育丛书(40)),针灸解惑,针灸解惑,针灸解惑"
